S. No;Quotation;Author;;;;;;;;;;;;;;;;;;
796;For, humanly speaking, death is the last thing of all;;;;;;;;;;;;;;;;;;;
797;Suppose someone wanting to learn to dance said: 'For hundreds of years now one generation after another has been learning dance steps, it's high time I took advantage of this and began straight off with a set of quadrilles.' One would surely laugh a little at him: but in the world of spirit such an attitude is considered utterly plausible. What then is education? I had thought it was the curriculum the individual ran through in order to catch up with himself;;;;;;;;;;;;;;;;;;;
798;A fé não constitui, portanto, um impulso de ordem estética;;;;;;;;;;;;;;;;;;;
799;¡Maldito azar! ¡Tú, mi único amigo íntimo, único ser al que creía digno de confianza, de mi alianza y de mi enemistad, siempre inestable y siempre igual a ti mismo, siempre incomprensible, eterno enigma!;Søren Kierkegaard,;;;;;;;;;;;;;;;;;;
800;There is so much talk about being offended by christianity because it is so dark and gloomy, offended because it is so rigorous etc. But it would be best of all to explain for once that the real reason that men are offended by christianity is that it is too high, because its goal is not man's goal, because it wants to make man into something so extraordinary that he cannot grasp the thought.;Søren Kierkegaard;;;;;;;;;;;;;;;;;;
801;sólo las naturalezas inferiores encuentran en otro la justificación de sus actos, sólo las naturalezas inferiores encuentran las premisas de sus actos fuera de sí mismas.;Søren Kierkegaard,;;;;;;;;;;;;;;;;;;
802;am not unacquainted with the dreadful, my memory is a faithful wife, and my imagination is (as I myself am not) a diligent little maiden who all day sits quietly at her work, and in the evening knows how to chat to me about it so prettily that I must look at it, though not always, I must say, is it landscapes, or flowers, or pastoral idylls she paints. I have seen the dreadful before my own eyes, I do not flee from it timorously, but I know very well that, although I advance to meet it, my courage is not the courage of faith, nor anything comparable to it.;Søren Kierkegaard,;;;;;;;;;;;;;;;;;;
803;The possibility of this sickness is man’s superiority over the animal, and this superiority distinguishes him in quite another way than does his erect walk, for it indicates infinite erectness or sublimity, that he is spirit.8 The possibility of this sickness is man’s superiority over the animal;;;;;;;;;;;;;;;;;;;
804;« I believe nevertheless that I shall get her, in virtue, that is, of the absurd, in virtue of the fact that with God all things are possible.;Søren Kierkegaard,;;;;;;;;;;;;;;;;;;
805;For it is not what happens to me that makes me great, but what I do, and there is surely no one who thinks that anyone became great by winning the big lottery prize.;Søren Kierkegaard,;;;;;;;;;;;;;;;;;;
806;And isn't it true here too that those whom God blesses he damns in the same breath?;Søren Kierkegaard,;;;;;;;;;;;;;;;;;;
807;If there were no eternal consciousness in a man, if at the foundation of all there lay only a wildly seething power which writhing with obscure passions produced everything that is great and everything that is insignificant, if a bottomless void never satiated lay hidden beneath all–what then would life be but despair?;Søren Kierkegaard,;;;;;;;;;;;;;;;;;;
808;It is an infinite merit to be able to despair.;Søren Kierkegaard,;;;;;;;;;;;;;;;;;;
809;Happy my lot in life if my desire coincides with my duty, and conversely;;;;;;;;;;;;;;;;;;;
810;The despairing man who is unconscious of being in despair is, in comparison with him who is conscious of it, merely a negative step further from the truth and from salvation.;Søren Kierkegaard;;;;;;;;;;;;;;;;;;
811;آه دایه‌ی عزیزم که نقشت هرگز از لوح دل و جانم نمی‌رود; تو ای پری‌روی گریزپای ساکن در جویباری که از کنار مزرعه‌ی پدرم می‌گذشت; تو که همواره در ایام صغر پا به پای من بازی می‌کردی گیرم فقط محض برآمدن کام دل خویش! تو ای راحتی‌بخش باوفای من; تو که در گذر سال‌ها پاکی و بی‌آلایشی خویش را از کف ندادی; تو که هرگز پیر نشدی; حتی زمانی که من پیر می‌شدم; تو ای پری‌روی نهرنشین خاموش که بارها در آغوشت پناه جستم; خسته و ملول از دست آدم‌ها; خسته و ملول از دست خویشتن; هر گاه که نیاز داشتم به قرار جستن در سایه‌ی ابدیت; چندان غمین که زمانی به پهنای ابدیت برای از یاد بردنش لازم بود; باری; تو هیچ‌گاه از من دریغ نکردی آنچه را آدمیان می‌خواستند از من دریغ کنند و بدین منظرو ابدیت را درست به اندازه‌ی زمان شلوغ می‌کردند و حتی آن را از زمان هم مخوف‌تر می‌ساختند. باری; کنار تو دراز می‌کشیدم و خود را در پهن‌دشت آسمان بالای سرم و در پچ پچ آرام تو گم می‌کردم! تو ای خودِ شاداب‌تر من!; تو ای حیات گریزپای مقیم در نهری که در کنار مزرعه‌ی پدرم جاری‌ست; آن‌جا که چنان دراز به دراز می‌خوابم که انگار عصایی هستم که رهگذری روی زمین گذاشته و رفته‌ست; اما من در این پچ‌پچ اندوه‌زا و ماخولیایی نجات می‌یابم و از بندها می‌رهم! این چنین در لژ خویش پا دراز می‌کردم; گوشه‌ای می‌افتادم مثل جامه‌های کسی که برای آب‌تنی رفته‌ست; دراز به دراز کنار جویبار فریادها و خنده‌ها و بی‌خیالی‌های تماشاچیان که شتابان از کنارم می‌گذشت.;Søren Kierkegaard,
812;So long as the generation only worries about its task, which is the highest it can attain to, it cannot grow weary. That task is always enough for a human lifetime. When children on holiday get through all their games by noon and then ask impatiently, 'Can't anyone think of a new game?', does this show that they are more developed and advanced than children of the same or a previous generation who could make the games they already know last the whole day? Or does it not rather show that those children lack what I would call the good-natured seriousness that belongs to play?;Søren Kierkegaard,;;;;;;;;;;;;;;;;;;
813;The matter is quite simple. The Bible is very easy to understand. But we Christians are a bunch of scheming swindlers. We pretend to be unable to understand it because we know very well that the minute we understand we are obliged to act accordingly. Take any words in the New Testament and forget everything except pledging yourself to act accordingly. My God, you will say, if I do that my whole life will be ruined. How would I ever get on in this world? Herein lies the real place of Christian scholarship. Christian scholarship is the Church’s prodigious invention to defend itself against the Bible, to ensure that we can continue to be good Christians without the Bible coming too close. Oh, priceless scholarship, what would we do without you? Dreadful it is to fall into the hands of the living God. Yes, it is even dreadful to be alone with the New Testament.I open the New Testament and read: ‘If you want to be perfect, then sell all your goods and give to the poor and come follow me.’ Good God, if we were to actually do this all the capitalists, the officeholders, and the entrepreneurs, the whole society in fact, would be almost beggars! We would be sunk if it were not for Christian scholarship! Praise be to everyone who works to consolidate the reputation of Christian scholarship, which helps to restrain the New Testament, this confounded book which would one, two, three, run us all down if it got loose (that is, if Christian scholarship did not restrain it).;Søren Kierkegaard;;;;;;;;;;;;;;;;;;
814;…existing cannot be done without passion.;Søren Kierkegaard;;;;;;;;;;;;;;;;;;
815;Quem alcançou neste mundo grandeza igual à dessa bendita mulher, a mãe de Deus, a virgem Maria? No entanto, como se fala dela? A sua grandeza não provém do fato de ter sido bendita entre as mulheres, e se uma estranha coincidência não levasse a assembléia a pensar com a mesma desumanidade do predicador, qualquer jovem devia, seguramente, perguntar: Por que não fui eu também bendita entre as mulheres? Se se não possuísse outra resposta, de forma alguma acharia ter de rejeitar esta pergunta, pretextando a sua falta de senso;;;;;;;;;;;;;;;;;;;
816;... when the ambitious man whose slogan is 'Either Caesar or nothing' does not get to be Caesar, he despairs over it. But this also means something else: precisely because he did not get to be Caesar, he now cannot bear to be himself.;KIERKERGAARD SOEREN;;;;;;;;;;;;;;;;;;
817;To be clear in my mind what I am to do, not what I am to know, except in so far as a certain understanding must precede every action. The thing is to understand myself…the thing is to find a truth which is true for me, to find the idea for which I can live and die.;Søren Kierkegaard;;;;;;;;;;;;;;;;;;
818;The highest of all is not to understand the highest but to act upon it.;Søren Kierkegaard;;;;;;;;;;;;;;;;;;
819;He writes because for him it is a luxury which becomes the more agreeable and more evident, the fewer there are who buy and read what he writes.;Søren Kierkegaard;;;;;;;;;;;;;;;;;;
820;"Existen dos maneras de ser engañados: una es creer lo que no es verdad y la otra es negarse a aceptar lo que sí lo es"".";Soren Kierkegaard;;;;;;;;;;;;;;;;;;
821;he who will not pass through this curriculum is helped very little by the fact that he was born in the most enlightened age.;Søren Kierkegaard,;;;;;;;;;;;;;;;;;;
822;To strive against the whole world is a comfort, to strive with oneself is dreadful.;Søren Kierkegaard,;;;;;;;;;;;;;;;;;;
823;In the constant sociability of our age people shudder at solitude to such a degree that they know no other use to put it to but (oh, admirable epigram!) as a punishment for criminals. But after all it is a fact that in our age it is a crime to have spirit, so it is natural that such people, the lovers of solitude, are included in the same class with criminals.;Søren Kierkegaard,;;;;;;;;;;;;;;;;;;
824;... joy and refreshment in contemplating the great men who have found that precious stone for which they sell all, even their lives... proceeding on their chosen course without vacillating...absorbed in themselves and in working towards their higher goal.;Søren Kierkegaard;;;;;;;;;;;;;;;;;;
825;The matter is quite simple. The bible is very easy to understand. But we Christians are a bunch of scheming swindlers. We pretend to be unable to understand it because we know very well that the minute we understand, we are obliged to act accordingly. Take any words in the New Testament and forget everything except pledging yourself to act accordingly. My God, you will say, if I do that my whole life will be ruined. How would I ever get on in the world?;Søren Kierkegaard;;;;;;;;;;;;;;;;;;
826;man who lives under his own supervision, alone in the whole world,;Søren Kierkegaard,;;;;;;;;;;;;;;;;;;
827;Compel a person to an opinion, a conviction, a belief - in all eternity, that I cannot do. But one thing I can do: I can compel him to become aware.;Søren Kierkegaard;;;;;;;;;;;;;;;;;;
828;The Bible is very easy to understand. But we Christians are a bunch of scheming swindlers. We pretend to be unable to understand it because we know very well that the minute we understand, we are obliged to act accordingly. — Søren Kierkegaard   * * * Quotation 10 — The greatest hazard of all, losing one’s self, can occur very quietly in the world, as if it were nothing at all. No;Søren Kierkegaard,;;;;;;;;;;;;;;;;;;
829;Even if the words were terrible, even though it were a Shakespeare, a Byron, or a Shelley who broke the silence,20 the word always retains its redeeming power, because all despair and all the horror of evil expressed in one word are not as awful as silence.;Søren Kierkegaard,;;;;;;;;;;;;;;;;;;
830;What Christendom needs at every moment is someone who expresses Christianity uncalculatingly or with absolute recklessness.;Søren Kierkegaard;;;;;;;;;;;;;;;;;;
831;A choice that is not used is worse than nothing;;;;;;;;;;;;;;;;;;;
832;Although I am still far from this kind of interior understanding of myself, with profound respect for its significance I have sought to preserve my individuality―worshipped the unknown God. With a premature anxiety I have tried to avoid coming in close contact with those things whose force of attraction might be too powerful for me. I have sought to appropriate much from them, studied their distinctive characteristics and meaning in human life, but at the same time guarded against coming, like the moth, too close to the flame. I have had little to win or to lose in association with the ordinary run of men, partly because what they do―so-called practical life―does not interest me much, partly because their coldness and indifference to the spiritual and deeper currents in man alienate me even more from them. With few exceptions my companions have had no special influence upon me. A life that has not arrived at clarity about itself must necessarily exhibit an uneven side-surface;;;;;;;;;;;;;;;;;;;
833;This is quite as clear to the knight of faith, so the only thing that can save him is the absurd, and this he grasps by faith. So he recognizes the impossibility, and that very instant he believes the absurd ;;;;;;;;;;;;;;;;;;;
834;Confess your love, you will regret it, confess it not, you will also regret that;;;;;;;;;;;;;;;;;;;
835;"A necessidade de solidão revela sempre a nossa espiritualidade, e serve para dar a sua medida. ""Essa espécie estouvada de homens, que o não são, esse rebanho de inseparáveis"" sentem-no tão pouco que, como os periquitos, morrem, mal se veem sozinhos";;;;;;;;;;;;;;;;;;;
836;If he is not supposed to be that, then he is a hypocrite, and the higher he climbs on this path, the more dreadful a hypocrite he is.;Søren Kierkegaard,;;;;;;;;;;;;;;;;;;
837;даже в своей любви к другому человеку важно быть достаточным для себя самого.;Søren Kierkegaard,;;;;;;;;;;;;;;;;;;
838;…when the ambitious man whose slogan is Either Caesar or nothing does not get to be Caesar, he despairs over it. But this also means something else: precisely because he did not get to be Caesar, he now cannot bear to be himself.;Søren Kierkegaard;;;;;;;;;;;;;;;;;;
839;There are two ways to be fooled. One is to believe what isn’t true;;;;;;;;;;;;;;;;;;;
840;There was one who was great in his strength, and one who was great in his wisdom, and one who was great in hope, and one who was great in love;;;;;;;;;;;;;;;;;;;
841;Despairing narrowness consists in the lack of primitiveness, or of the fact one has deprived oneself of one’s primitiveness;;;;;;;;;;;;;;;;;;;
842;The one who in mortal danger forgets himself and lets the other have the only life-saving plank, that one loves much. So also the one who at the moment when everything in his inner being and everything around him not only reminds him of himself but wants to compel him against his will to think about himself--if he nevertheless forgets himself, that one loves much, just as [the Sinful Woman] did.;Søren Kierkegaard,;;;;;;;;;;;;;;;;;;
843;But still he must have recourse to the paradox. For when the individual by his guilt has gone outside the universal he can return to it only by virtue of having come as the individual into an absolute relationship with the absolute.;Søren Kierkegaard,;;;;;;;;;;;;;;;;;;
844;Skal man hjelpe en annen, må man først finne ut hvor han er, og møte ham der. Dette er det første bud i all sann hjelpekunst.;Søren Kierkegaard;;;;;;;;;;;;;;;;;;
845;Érase cierta vez un hombre que en su infancia había oído contar la hermosa historia de cómo Dios quiso probar a Abraham, y cómo éste soportó la prueba, conservó la fe y, contra esperanza, recuperó de nuevo a su hijo. Siendo ya un hombre maduro volvió a leer aquella historia y le admiró todavía más, porque la vida había separado lo que se había presentado unido a la piadosa ingenuidad del niño. Y sucedió que cuanto más viejo se iba haciendo, tanto más frecuentemente volvía su pensamiento a este relato: su entusiasmo crecía más y más, aunque, a decir verdad, cada vez lo entendía menos.;Søren Kierkegaard,;;;;;;;;;;;;;;;;;;
846;loved. For he who loved himself became great by himself, and he who loved other men became great by his selfless devotion, but he who loved God became greater than all.;Søren Kierkegaard,;;;;;;;;;;;;;;;;;;
847;No me gustan las jóvenes que se consideran interesantes, pues sólo se llega a serlo tras un estudio de uno mismo, igual que en lo interesante se exhibe siempre la persona del artista. Una señora que pretenda gustar por ser interesante, ha de comenzar por agradarse a sí misma. Esto no es bonito: constituye una de las desventajas que la estética puede reprochar a la coquetería;Søren Kierkegaard,;;;;;;;;;;;;;;;;;;
848;So the merman cannot belong to Agnes unless, after having made the infinite movement, the movement of repentance, he makes still one more movement by virtue of the absurd.;Søren Kierkegaard,;;;;;;;;;;;;;;;;;;
849;Deep within every human being there still lives the anxiety over the possibility of being alone in the world, forgotten by God, overlooked among the millions and millions in this enormous household. A person keeps this anxiety at distance by looking at the many round about who are related to him as kin as friends, but the anxiety is still there.;Søren Kierkegaard;;;;;;;;;;;;;;;;;;
850;The philistine tranquillises himself with the trivial.;Søren Kierkegaard;;;;;;;;;;;;;;;;;;
851;Yet in another and still more definite sense despair is the sickness unto death. It is indeed very far from being true that, literally understood, one dies of this sickness, or that this sickness ends with bodily death. On the contrary, the torment of despair is precisely this, not to be able to die So it has much in common with the situation of the moribund when he lies and struggles with death, and cannot die. So to be sick unto death is, not to be able to die -- yet not as though there were hope of life;;;;;;;;;;;;;;;;;;;
852;But, but, but here lies the difficulty. Precisely what the New Testament understands by Christianity and by being a Christian is-and this the New Testament makes no effort to conceal but emphasizes decisively-what most of all is repugnant to the natural man, is an offense to him, against which with wild passion and defiance he must revolt, or else cunningly try at any price to be rid of it, as for example by the help of a knavish trick, calling Christianity what is the exact opposite of Christianity, and then thanking God for Christianity and for the great and inestimable privilege of being a Christian. Attack On Christendom pp 150-3;Søren Kierkegaard;;;;;;;;;;;;;;;;;;
853;Only the Eternal is always appropriate and always present, is always true. Only the Eternal applies to each human being,;Søren Kierkegaard,;;;;;;;;;;;;;;;;;;
854;Ja savršeno nisam ni za šta. Ne mogu da jašem konja, on se suviše oštro kreće;;;;;;;;;;;;;;;;;;;
855;As the Good itself is only one thing, so it alone wishes to be what helps us along. But the Good is not something external to us, like a slave who comes against his will when the master uses the whip. The place and the path are within each of us. And just as the place is the blessed state of the striving soul, so the path is the striving soul's continual transformation.;Søren Kierkegaard,;;;;;;;;;;;;;;;;;;
856;This sectarianism is an attempt to leap away from the narrow path of the paradox and become a tragic hero at a cheap price. The tragic hero expresses the universal and sacrifices himself for it. The sectarian punchinello, instead of that, has a private theatre, i.e. several good friends and comrades who represent the universal;Søren Kierkegaard,;;;;;;;;;;;;;;;;;;
857;There are handbooks for everything, and very soon education, all the world over, will consist in learning a greater or lesser number of comments by heart, and people will excel according to their capacity for singling out the various facts like a printer singling out the letters, but completely ignorant of the meaning of anything.;Søren Kierkegaard,;;;;;;;;;;;;;;;;;;
858;So despair, then, and your frivolity shall never more cause you to roam like an inconstant spirit, like a ghost among the ruins of a world which is yet lost to you;;;;;;;;;;;;;;;;;;;
859;Con frecuencia se me ocurrió pensar en la razón de que sean tan perjudiciales las relaciones demasiado frecuentes entre muchachas;;;;;;;;;;;;;;;;;;;
860;But a sad fatality hung over this young girl. She had been given to seven husbands, all of whom had perished in the bride-chamber.;Søren Kierkegaard,;;;;;;;;;;;;;;;;;;
861;My depression is the most faithful mistress I have known — no wonder, then, that I return the love.;Søren Kierkegaard,;;;;;;;;;;;;;;;;;;
862;it is a sign of a magnanimous man of profound soul that he is disposed to repent, that he does not go to law with God but repents and loves God in his repentance. Without that his life is nothing, merely like foam on water.;Søren Kierkegaard, Either/Or, Part I;;;;;;;;;;;;;;;;;;
863;The proud person always wants to do the right thing, the great thing. But because he wants to do it in his own strength, he is fighting not with man, but with God. — Søren Kierkegaard;Søren Kierkegaard,;;;;;;;;;;;;;;;;;;
864;Jeg kommer netop nu fra et Selskab, hvor jeg var Sjælen;;;;;;;;;;;;;;;;;;;
865;None has more contempt for what it is to be a man than they who make it their profession to lead the crowd.;Søren Kierkegaard,;;;;;;;;;;;;;;;;;;
866;la fe […] es lo más grande que se pueda poseer;;;;;;;;;;;;;;;;;;;
867;La fe […] comienza con los movimientos del infinito, y sólo más tarde pasa a los de lo infinito.;Søren Kierkegaard,;;;;;;;;;;;;;;;;;;
868;veed Du da ikke, at der kommer en Midnatstime, hvor Enhver skal demaskere sig, troer Du, at Livet altid lader sig spøge med, troer Du, at man kan liste bort lidt før Midnat for at undgaae det?;Kierkegaard, Enten – Eller;;;;;;;;;;;;;;;;;;
869;A man can wish to slink away from many things in life, and he may even succeed, so that life’s favored one can say in the last moment, I slipped away from all the cares under which other men suffered. But if such a person wishes to bluster out of, to defy, or to slink away from remorse, alas, which is indeed the most terrible to say of him, that he failed, or — that he succeeded?;Søren Kierkegaard,;;;;;;;;;;;;;;;;;;
870;Una muchacha, en ciertos aspectos, no se desarrolla igual que un muchacho: no crece, sino que nace ya hecha. El muchacho inicia en seguida su desarrollo y necesita largo tiempo para cumplirlo;;;;;;;;;;;;;;;;;;;
871;Love from the soul is a continuation in time, sensual love a disappearance in time (pp 101);Søren Kierkegaard,;;;;;;;;;;;;;;;;;;
872;Det gäller att finna en sanning, som är sanning för mig, att finna en idé för vilken jag vill leva och dö.;Soren Kierkegaard;;;;;;;;;;;;;;;;;;
873;"How far removed in time must an event be for us to remember it? How far for memory's longing to be no longer able to seize it? Most people have a limit in this respect: what lies too near them in time they cannot remember, nor what lies too remote. I know no limit. What was experienced yesterday, I push back a thousand years in time, and remember as if it were yesterday.""―Johannes de Silentio, from_Either/Or_";Søren Kierkegaard;;;;;;;;;;;;;;;;;;
874;he who loves God without faith reflects upon himself he who loves God believingly reflects upon God.;Søren Kierkegaard,;;;;;;;;;;;;;;;;;;
875;And the desire to prevent all misunderstanding about an enterprise one is about to undertake is a thing that could occur only to a youth. There is nothing that so easily gets beyond one's control and so easily becomes misunderstood, as a misunderstanding. Even if one were to undertake nothing more than merely to avoid misunderstanding – then in that case one would presumably become the most thoroughly misunderstood of all men.;Søren Kierkegaard,;;;;;;;;;;;;;;;;;;
876;The glorious memory to be preserved by the human race, the promise in Abraham’s seed – this was only a whim, a fleeting thought which the Lord had had, which Abraham should now obliterate. That glorious treasure which was just as old as faith in Abraham’s heart, many, many years older than Isaac, the fruit of Abraham’s life, sanctified by prayers, matured in conflict – the blessing upon Abraham’s lips, this fruit was now to be plucked prematurely and remain without significance.;Søren Kierkegaard,;;;;;;;;;;;;;;;;;;
877;She awakens first at the touch of love;;;;;;;;;;;;;;;;;;;
878;People who do not know how to remain silent, do not know how to talk.;Søren Kierkegaard,;;;;;;;;;;;;;;;;;;
879;It doesn't appeal to experience, which of all laughable things is perhaps the most laughable and, far from making a man wise, if he knows nothing higher it will soon make him mad.;Søren Kierkegaard;;;;;;;;;;;;;;;;;;
880;To live in the unconditional, inhaling only the unconditional, is impossible to man;;;;;;;;;;;;;;;;;;;
