S. No;Quotation;Author;;;;;;;;;;;;;;;;;;
2055;سعارُ اليأس يدفع بي في وجه كل شيء: الطبيعة; الأشياء;;;;;;;;;;;;;;;;;;
2056;الحياة تزدهر بالعمل; حقيقة قديمة: أنا;;;;;;;;;;;;;;;;;;
2057;No one's serious at seventeen,When lindens line the promenades;Arthur Rimbaud;;;;;;;;;;;;;;;;;;
2058;Madame X set up a piano in the Alps.;Rimbaud, Arthur;;;;;;;;;;;;;;;;;;
2059;These verses believe;;;;;;;;;;;;;;;;;;;
2060;لا أحب النساء. الحب ينبغي إعادة ابتكاره; ذلك شيء معلوم. هن لم يعدن قادرات إلا على اشتهاء عَيشٍ مُؤمّن. وما إن ينلنه حتى يضعن جانبا القلب والجمال: فلا يبقى سوى ازدراء بارد;;;;;;;;;;;;;;;;;;
2061;إنّ كل ما تعلّمنا زائف;Arthur Rimbaud;;;;;;;;;;;;;;;;;;
2062;A man who wants to mutilate himself is certainly damned, isn't he?;Arthur Rimbaud;;;;;;;;;;;;;;;;;;
2063;J'écrivais des silences, des nuits, je notais l'inexprimable. Je fixais des vertiges.;Arthur Rimbaud;;;;;;;;;;;;;;;;;;
2064;ينبغي أن يكون لي جحيمي للغضب; وجحيمي للكبرياء;;;;;;;;;;;;;;;;;;
2065;Against snow, a tall Beautiful Being. Whistlings of death and circles of muffled music make this adored body rise, swell and tremble like a ghost;;;;;;;;;;;;;;;;;;;
2066;Come back, come back, dear friend, only friend, come back. I promise to be good.;Arthur Rimbaud,;;;;;;;;;;;;;;;;;;
2067;لأي شيطان [أنا أكون] أؤجّرني؟ لأي حيوان ينبغي أن أعبد؟ في أي دم ينبغي أن أخوض؟ أي صراخ ينبغي أن أُطلق؟ أية أكذوبة ينبغي أن أدعَم؟ أية صورة مقدسة يجب أن أُهاجم؟ أية قلوب ينبغي تحطيمها؟;آرتور رامبو;;;;;;;;;;;;;;;;;;
2068;وددتُ لو أكون الطفلَ المهجورَ على أرصفة المرفأ المُتطاول حتى عرض البحر; الخادمَ الصغيرَ يجتاز الممشى وجبينه يلامس السماء;;;;;;;;;;;;;;;;;;
2069;يصبح الشاعر رائياً بفعل تشويش طويل;" واسع ومدروس لجميع الحواس. ينبغي أن يعرف جميع أشكال الحب والمعاناة والجنون؛ أن يبحث بنفسه عن جميع السّموم";;;;;;;;;;;;;;;;;;
2070;Pagan blood returns!;Arthur Rimbaud;;;;;;;;;;;;;;;;;;
2071;به همه جا برو به همه چیز پاسخ بده هیچ چیز نمی تواند جسد تو را دوباره بکشد!;آرتور رمبو;;;;;;;;;;;;;;;;;;
2072;Cela s'est passé. Je sais aujourd'hui saluer la beauté.;Arthur Rimbaud,;;;;;;;;;;;;;;;;;;
2073;Je devrais avoir mon enfer pour la colère, mon enfer pour l'orgueil, - et l'enfer de la caresse;;;;;;;;;;;;;;;;;;;
2074;Aphrodite’s thirst was never quenched;;;;;;;;;;;;;;;;;;;
2075;الحلم الأمومي بساطٌ دافئ ; عشٌ من القطن يلبد فيه صغار;;;;;;;;;;;;;;;;;;
2076;!فليَثِبِ الفكر حراً وسيؤمن الإنسان;آرتور رامبو;;;;;;;;;;;;;;;;;;
2077;As of today, I rebel against death! Work seems frivolous;;;;;;;;;;;;;;;;;;;
2078;Elle est retrouvée Quoi ? – L’Eternité. C’est la mer allée Avec le soleil.;Arthur Rimbaud;;;;;;;;;;;;;;;;;;
2079;"كنت أصرفُ إلى الشيطان أكاليل الشهداء وإشعاعات الفن وخيلاء المخترعين وحميّة النهّابين؛ كنت أعود إلى الشرق"; إلى الحكمة البادئة السرمديّة;;;;;;;;;;;;;;;;;;
2080;.ثمة خراب ضروري;Arthur Rimbaud;;;;;;;;;;;;;;;;;;
2081;عندما ينتهي استعباد المرأة غير المتناهي; وعندما تحيا هي من أجل ذاتها وبذاتها;;;;;;;;;;;;;;;;;;
2082;"الدرس الأول لمن يريد أن يكون شاعرا هو المعرفة الكاملة لنفسه؛ يبحث عن روحه"; يفتش عنها;;;;;;;;;;;;;;;;;;
2083;كنت قد ابتكرت جميع الأعياد; جميع الانتصارات;;;;;;;;;;;;;;;;;;
2084;ليس الفعلُ الحياة; بل هو شاكلةٌ في هدر قوة;;;;;;;;;;;;;;;;;;
2085;What will happen to the world when you leave it? Nothing, in any case, will remain of what is now visible.;Arthur Rimbaud,;;;;;;;;;;;;;;;;;;
2086;J'aimais les peintures idiotes, dessus de portes, décors, toiles de saltimbanques, enseignes, enluminures populaires ;;;;;;;;;;;;;;;;;;;
2087;نعرف كيف نهبُ حياتنا كاملة كل يوم;Arthur Rimbaud;;;;;;;;;;;;;;;;;;
2088;La musique savante manque à notre désir;Arthur Rimbaud,;;;;;;;;;;;;;;;;;;
2089;كانت الأخلاق هي رخاوة الدماغ. كانت الكائنات والأشياء جميعا تبدو لي....... حيوات أخرى حولها....... لحظة من حيواتهم الأخرى....... لا مبادئ;آرتور رامبو;;;;;;;;;;;;;;;;;;
2090;The hallucinations are innumerable. That's what has always been the matter with me, in fact: no belief in history, obliviousness of principles. I shall say no more about this: poets and visionaries would be jealous. I am a thousand times the richest, let's be as miserly as the sea.;Arthur Rimbaud,;;;;;;;;;;;;;;;;;;
2091;But to explore the invisible and to hear the unheard are very different from reviving the dead: Baudelaire is therefore first among seers, the king of poets, a true God.;Arthur Rimbaud;;;;;;;;;;;;;;;;;;
2092;"ليس يمكن الوثوق بأحدٍ في الدنيا؛ والبشر الفانون ليس يلمسون سعادةً صادقةً أبداً؛ من عطر الزّهر نفسه";آرتور رامبو;;;;;;;;;;;;;;;;;;
2093;I came a fabulous opera. I saw that all beings have a fatality for happiness: action is not life, but a way of spending your strength, an irritation. Morality is a weakness of the brain.;Arthur Rimbaud,;;;;;;;;;;;;;;;;;;
2094;"العالَمُ فاسد؛ أوَ يدهشُكَ هذا! عِشُ"; وإلى النّار ارمِ نكدَ الطّالعِ;;;;;;;;;;;;;;;;;;
2095;"أدركتُ أنها كانت منهمكة في حياتها اليومية؛ وأن التفاتةَ الطيبةِ ستكون أبطأ في المعاوَدة من نجمة. لم تعدْ"; ولن تعودَ أبداً;;;;;;;;;;;;;;;;;;
2096;ولأنه ما أحبّ امرأةً - مع أنه كان مفعماً عنفواناً! -; فقد تربّتْ روحه وقلبه وجميع قواه وسطَ أخطاءٍ غريبةٍ مُحزنة;;;;;;;;;;;;;;;;;;
2097;:فظيعٌ كلّ قمرٍ; مريرةٌ كلّ شمس  الحب اللاذع نفخني بخَدرٍ مسكر  !حبّذا لو تَفجّرت عارضتي !حّبذا لو مضيتُ إلى البحر;;;;;;;;;;;;;;;;;;
2098;Along the open road on winter nights, homeless, cold, and hungry, one voice gripped my frozen heart: 'Weakness or strength: you exist, that is strength. You don't know where you are going or why you are going, go in everywhere, answer everyone. No one will kill you, any more than if you were a corpse.' In the morning my eyes were so vacant and my face so dead, that the people I met may not even have seen me.In cities, mud went suddenly red and black, like a mirror when a lamp in the next room moves, like treasure in the forest! Good luck, I cried, and I saw a sea of flames and smoke rise to heaven;;;;;;;;;;;;;;;;;;;
2099;Quick! Aren’t there other ways of living?− To sleep in the midst of wealth is impossible. Wealth has always been public property. Divine love alone offers the keys to science. I see that nature is only a spectacle of plenitude. Farewell chimeras, ideals, errors! The reasonable song of the angels rises up from therescue ship: it is divine love. − Two loves! I may die of earthly love, die of devotion. I have left behind me souls whose suffering will only increase at my going! You chose me from among the shipwrecked, but what about the friends I left behind? Save them!;Arthur  Rimbaud,;;;;;;;;;;;;;;;;;;
2100;Oh! science! It has reconsidered everything. For thebody and the soul − the viaticum − we now have medicineand philosophy, old wives’ remedies and rearranged popular songs. And the diversions of princes and games they forbade! Geography, cosmography, mechanics, chemistry . . . Science, the new nobility! Progress. The world marches on! Why would it cease to turn? It is the vision of numbers. We are moving towards Spirit. What I say is certain, oracular. I understand, but not knowing how to explain myself without using pagan words, I prefer to hold my tongue.;Arthur  Rimbaud,;;;;;;;;;;;;;;;;;;
2101;They find me odd, and whisper behind hands…And my brutal desires sink hooks into their lips…;Arthur Rimbaud,;;;;;;;;;;;;;;;;;;
2102;Je finis par trouver sacré le désordre de mon esprit.;Arthur Rimbaud;;;;;;;;;;;;;;;;;;
2103;Oh! Science! Everything has been revised. For the body and for the soul,--the viaticum,—there are medicine and philosophy,—old wives' remedies and popular songs rearranged. And the pastimes of princes and games they proscribed! Geography, cosmography, mechanics, chemistry!...Science, the new nobility! Progress. The world marches on! Why shouldn’t it turn?It is the vision of numbers. We are going toward the Spirit. There’s no doubt about it, an oracle, I tell you. I understand, and not knowing how to express myself without pagan words, I’d rather remain silent.;Arthur Rimbaud,;;;;;;;;;;;;;;;;;;
2104;I am unknown: so what?This verses believe;;;;;;;;;;;;;;;;;;;
2105;A Black, E white, I red, U green, O blue: vowels,Someday I shall tell of your mysterious births:A, black velvety corset of dazzling fliesBuzzing around cruel smells,Gulfs of shadow;;;;;;;;;;;;;;;;;;;
2106;C'était comme une nuit d'hiver, avec une neige pour étouffer le monde décidément.;Arthur Rimbaud;;;;;;;;;;;;;;;;;;
2107;آه! أنا إلى هذا الحد مهجورٌ بحيث أهدي أية صورة سماوية وثباتٍ نحو الكمال. صفقة خرقاء أخرى;آرتور رامبو;;;;;;;;;;;;;;;;;;
2108;من كلّ غصن; من القطرات الخضرمن البراعم المتألقةيحسُّ في الأشياء المتفتحةبقشعريرة اللحم;;;;;;;;;;;;;;;;;;
2109;آه; الحب;;;;;;;;;;;;;;;;;;
2110;هيّا; إلى السير! الصحراء والعبء والضّربات والشقاء والسّأم والغضب.- الجحيم;;;;;;;;;;;;;;;;;;
2111;بينا تُنفق الأموال العامة في أعياد للتآخي; يرنُّ في الغيوم ناقوسُ نار وردية;;;;;;;;;;;;;;;;;;
2112;عندما نكون بالغي القوة; فمن منّا يتراجع؟;;;;;;;;;;;;;;;;;;
2113;Hire myself out to whom? What beast must I worship? What sacred images should I destroy? What hearts shall I break? What lies am I supposed to believe? March through whose blood?;Arthur Rimbaud,;;;;;;;;;;;;;;;;;;
2114;أيها العالم! الغناء الصافي لأحزان جديدة!;Arthur Rimbaud;;;;;;;;;;;;;;;;;;
2115;يا لتلك الحياة في طفولتي; يوم كنت في كبار الطّرق في كل طقس;;;;;;;;;;;;;;;;;;
2116;J'ai seul la clef de cette parade sauvage.;Arthur Rimbaud;;;;;;;;;;;;;;;;;;
2117;Les Poets de Sept ansEt la Mère, fermant le livre du devoir,S'en allait satisfaite et très fière sans voir,Dans les yeux bleus et sous le front plein d'éminences,L'âme de son enfant livrée aux répugnances.Tout le jour, il suait d'obéissance ;;;;;;;;;;;;;;;;;;;
2118;!كم أتحول إلى عانس بافتقاري إلى شجاعة محبة الموت;آرتور رامبو;;;;;;;;;;;;;;;;;;
2119;جميع المهن تُفزعني. السادة والعمال جميعاً فلّاحون بلا نبالة;آرتور رامبو;;;;;;;;;;;;;;;;;;
2120;Nous ne pouvons savoir ! - Nous sommes accablés D'un manteau d'ignorance et d'étroites chimères ! Singes d'hommes tombés de la vulve des mères, Notre pâle raison nous cache l'infini ! Nous voulons regarder : - le Doute nous punit ! Le doute, morne oiseau, nous frappe de son aile... - Et l'horizon s'enfuit d'une fuite éternelle !...;Arthur Rimbaud;;;;;;;;;;;;;;;;;;
2121;The wolf howled under the leaves As he spat out the bright feathers Of his feast of fowl: Like him, I devour myself. Lettuce and fruit Wait only to be picked;;;;;;;;;;;;;;;;;;;
2122;أزمنةً كانت الأشجار الصامتة تهدهد فيها الطائر الشادي  والأرض تهدهد الإنسان; والأقيانوس الأزرق  !وجميع الحيوانات تتحاب;;;;;;;;;;;;;;;;;;
2123;Os poetas serão! Quando for abolida a servidão infinita da mulher, quando ela viver para ela e por ela, tendo-lhe o homem dado baixa – até agora abominável -, ela também será poeta! A mulher encontrará o desconhecido! Divergirão dos nossos os seus mundos de ideias? Ela descobrirá coisas estranhas, insondáveis, repugnantes, deliciosas, tomá-las-emos e compreenderemos;Arthur Rimbaud;;;;;;;;;;;;;;;;;;
2124;"In winter we’ll travel in a little pink carriageWith cushions of blue.We’ll be fine. A nest of mad kisses waitsIn each corner too.You’ll shut your eyes, not to see, through the glass,Grimacing shadows of evening,Those snarling monsters, a crowd going pastOf black wolves and black demons.Then you’ll feel your cheek tickled quite hard…A little kiss, like a maddened spider,Will run over your neck…And you’ll say: Catch it! bowing your head,– And we’ll take our time finding that creature– Who travels so far…Arthur Rimbaud, ""A Winter Dream,"" Rimbaud: Selected Works. (A. S. Kline, 2002, 2003)";Arthur Rimbaud,;;;;;;;;;;;;;;;;;;
2125;كنتُ كمثْلِ يافطةِ نُزلٍ مُريبة;آرتور رامبو;;;;;;;;;;;;;;;;;;
2126;كنتُ لمحتُ [النّجاة] والهداية والخير والسعادة والنّجاة. هل لي أن أصفَ الرؤية; لا نكونُ شعراءَ في [داخل] الجحيم;;;;;;;;;;;;;;;;;;
2127;Elle est retrouvée!-Quoi? -l'Éternité.C'est la mer mêléeAu soleil.Je devins un opéra fabuleux : je vis que tous les êtres ont une fatalité de bonheur : l'action n'est pas la vie, mais une façon de gâcher quelque force, un énervement. La morale est la faiblesse du cerveau.À chaque être, plusieurs autres vies me semblaient dues. Ce monsieur ne sait pas ce qu'il fait : il est un ange.;Arthur Rimbaud,;;;;;;;;;;;;;;;;;;
2128;Ho teso corde da campanile a campanile;;;;;;;;;;;;;;;;;;;
2129;Έγινα μια όπερα περίφημη: Είδα πως κάθε πλάσμα καταδικάσθηκε στην ευτυχία. Η δράση δεν είναι ζωή, είναι ένας τρόπος να εξασθενείς, ένας εκνευρισμός. Η ηθική είναι η αδυναμία του εγκεφάλου.;Arthur Rimbaud,;;;;;;;;;;;;;;;;;;
2130;أنا المُتعقّب الأزليّ للثّباتات الزّرقاء;آرتور رامبو;;;;;;;;;;;;;;;;;;
2131;Weakness or strength: there you are, strength. You do not know where you are going, nor why you are going;;;;;;;;;;;;;;;;;;;
2132;Peut-on s'extasier dans la destruction, se rajeunir par la cruauté !;Arthur Rimbaud,;;;;;;;;;;;;;;;;;;
2133;Le poète est vraiment voleur de feu.;Arthur Rimbaud,;;;;;;;;;;;;;;;;;;
2134;Priests, professors, masters, you are wrong to turn me over to Justice. I have never belonged to this people. I have never been Christian. I am of the race that sang under torture. I do not understand your laws. I have no moral sense, I am a brute.;Arthur  Rimbaud,;;;;;;;;;;;;;;;;;;
2135;Yes, my eyes are closed to your light. I am a beast, a nigger. But I can be saved. You are sham niggers, you, maniacs, fiends, misers. Merchant, you are a nigger;;;;;;;;;;;;;;;;;;;
2136;Et je redoute l'hiver parce que c'est la saison du comfort!;RIMBAUD ARTHUR,;;;;;;;;;;;;;;;;;;
2137;The white men are landing. Cannons! Now we must be baptized, get dressed, and go to work. My heart has been stabbed by grace. Ah! I hadn't thought this would happen!;Arthur Rimbaud,;;;;;;;;;;;;;;;;;;
2138;العلمُ; النّبالةُ الجديدة! التقدّم. العالَم يسير! ما لَهُ لا يدور؟;;;;;;;;;;;;;;;;;;
2139;Delivered to oblivion...growing and flowering with incense and weeds to the sullen whine of nasty flies... I loved deserts, burnt out orchards, faded boutiques...I dragged myself down stinking alleyways... General, if there's an old cannon left, aim for the glass of splendid shops, into the living rooms...make the city eat its own dust.;Arthur Rimbaud,;;;;;;;;;;;;;;;;;;
2140;التنكّر; للفرح;;;;;;;;;;;;;;;;;;
2141;حُزِ الموتَ بكل ما لديكَ من شهيّةٍ; بأنانيتكَ وجميع الكبائر;;;;;;;;;;;;;;;;;;
2142;Oisive jeunesseÀ tout asservie,Par délicatesseJ'ai perdu ma vie.;Rimbaud Arthur;;;;;;;;;;;;;;;;;;
2143;Let it come, let it come The time that we will love. So patient have I been That I’ve forgetten everything: Fear and suffering Have departed for the heavens, And an unholy thirst Darkens my veins. Let it come, let it come The time that we will love. Like the field Left to forgetfulness, Growing and flowering With incense and weeds, And the fierce buzzing Of dirty flies. Let it come, let it come The time that we will love. I loved the desert, burnt orchards, musty shops, tepid drinks. I dragged myself through stinking alleys, and with eyes closed I offered myself to the sun, the god of fire.;Arthur  Rimbaud,;;;;;;;;;;;;;;;;;;
2144;I am not a prisoner of my reason.- Bad Blood;Arthur Rimbaud,;;;;;;;;;;;;;;;;;;
2145;The same bourgeois magic everywhere the mail train sets you down.;Arthur Rimbaud;;;;;;;;;;;;;;;;;;
2146;لكم الهلاكُ! أيتها القوة; أيتها العدالة;;;;;;;;;;;;;;;;;;
2147;أفي هذه اللّيالي التي لا قرار لها تنامُ وتُقيمُ مَنفاكمليون طائرٍ ذهبيّ; أنتَ يا عنفوانَ المستقبل؟;;;;;;;;;;;;;;;;;;
2148;I believe I am in Hell, therefore I am;Arthur Rimbaud;;;;;;;;;;;;;;;;;;
2149;الأصواتُ المُستنيرةُ مَنفيَّةٌ...;Arthur Rimbaud,;;;;;;;;;;;;;;;;;;
2150;Je dis qu'il faut être voyant, se faire voyant. Le poète se fait voyant par un long, immense et raisonné dérèglement de tous les sens.;Rimbaud Arthur,;;;;;;;;;;;;;;;;;;
2151;The flowering sweetness of the stars,;Arthur Rimbaud,;;;;;;;;;;;;;;;;;;
2152;Poor innocents! Hell has no power overpagans. − And still this is life! Later, the delights of damnation will be all the greater. A crime, quick, so I can fall into nothingness, condemned by human laws. Shut up, will you shut up! . . . Shame and Reproach are here: Satan says the fire is contemptible, my angerridiculous. − Enough! . . . Errors are whispered on their breath, spells, sickly perfumes, insipid music. − And to think that I hold truth in my hands, that I see justice: my judgement is sound and certain, I am ready forperfection . . . Pride. − The skin of my scalp is dry. Have pity! Lord, I am afraid. I am thirsty, so thirsty! Oh! childhood, the smell of grass, the sound of rain, water from the lake lapping on pebbles, the moonlight when theclock strikes twelve . . . that’s when the devil is in thetower. Mary! Holy Virgin! . . . − The horror of my stupidity. Aren’t there any honest souls who wish me well down there? . . .;Arthur  Rimbaud,;;;;;;;;;;;;;;;;;;
2153;На седемнадесет човек е само млад.;Arthur Rimbaud,;;;;;;;;;;;;;;;;;;
2154;როცა დავყევ დინებას უგრძნობელ მდინარეების, მებორნეების ძალებით აღარ ვიყავ მართული;არტურ რემბო;;;;;;;;;;;;;;;;;;
2155;Расчеты в сторону - и тогда неизбежно опускается небо;;;;;;;;;;;;;;;;;;;
2156;...есть больше оснований восхищаться людьми, чем презирать их.;Arthur Rimbaud,;;;;;;;;;;;;;;;;;;
2157;Моя жизнь истощилась. Ну что ж! Притворяться и бездельничать будем, - о жалость!;Arthur Rimbaud,;;;;;;;;;;;;;;;;;;
2158;cement in bold relief,—far underground. I lean my elbows on the table, and the lamp lights brightly the newspapers I am fool enough to re-read, and the absurd books.;Arthur Rimbaud,;;;;;;;;;;;;;;;;;;
2159;Estendi cordas de campanário a campanário;;;;;;;;;;;;;;;;;;;
2160;À moi. L'histoire d'une de mes folies. - Une saison en enfer;Arthur Rimbaud;;;;;;;;;;;;;;;;;;
2161;Hatırladığım kadarıyla, vaktiyle, hayatım bir şölendi, tüm gönüllerin açıldığı, tüm şarapların aktığı bir şölen. Bir akşam, Güzelliği dizlerimin üstüne oturttum. -Ve onu çok acı buldum.- Ve sövdüm ona. Adalete karşı önlem aldım. Kaçtım uzaklara. Ey büyücüler, ey sefillik, ey kin, hazinem size emanet! Kafamdaki tüm insani umutları yok etmeyi başardım. Her sevincin üstüne sıçradım bir vahşi hayvan gibi boğmaz için. Yanıma cellatlar çağırdım, ölürken, tüfeklerinin dipçiklerini ısırayım diye. Belalar çağırdım, kumla, kanla beni boğsunlar diye. Mutsuzluk ilahım oldu. Çamura uzandım boylu boyuna. Cinayet havasıyla kurulandım. Ve nice oyunlar oynadım delicesine. Ve ilkbahar getirdi bana budalalığın ürkütücü gülümsemesini.;Arthur Rimbaud,;;;;;;;;;;;;;;;;;;
2162;I’m the Saint praying on a balcony - like peaceful beasts grazing along the Sea of Palestine. I’m the scholar in a plain reading chair. Branches and rain beat the library windows. I’m the pedestrian on the high road through the stunted woods;;;;;;;;;;;;;;;;;;;
2163;Mais, vrai, j'ai trop pleuré! Les aubes sont navrantes.Toute lune est atroce et tout soleil amer.;Arthur Rimbaud;;;;;;;;;;;;;;;;;;
2164;Hacía ya mucho tiempo que me vanagloriaba de poseer todos los paisajes posibles, y que se me antojaban irrisorias todas las celebridades de la pintura y de la poesía moderna.Me gustaban las pinturas idiotas: adornos de puertas, decorados, telones de saltimbancos, emblemas, estampas populares;;;;;;;;;;;;;;;;;;;
2165;You must set yourself freeFrom the striving of ManAnd the applause of the WorldYou must fly as you can...- No hope foreverNo orietur.Science and patience,The torment is sure.The fire within you,Soft silken embers,Is our whole dutyBut no one remembers.It is recovered.What? Eternity.In the whirling lightOf the sun in the sea.;Arthur Rimbaud,;;;;;;;;;;;;;;;;;;
2166;Far from birds, from flocks and village girls, What did I drink, on my knees in the heather Surrounded by a sweet wood of hazel trees, In the warm and green mist of the afternoon? What could I drink from that young Oise, − Voiceless elms, flowerless grass, an overcast sky! − Drinking from these yellow gourds, far from the hut I loved? Some golden spirit that made me sweat. I would have made a dubious sign for an inn. − A storm came to chase the sky away. In the evening Water from the woods sank into the virgin sand, And God’s wind threw ice across the ponds. Weeping, I saw gold − but could not drink. − ——— At four in the morning, in the summer, The sleep of love still continues. Beneath the trees the wind disperses The smells of the evening feast. Over there, in their vast wood yard, Under the sun of the Hesperidins, Already hard at work − in shirtsleeves − Are the Carpenters. In their Deserts of moss, quietly, They raise precious panelling Where the city Will paint fake skies. O for these Workers, charming Subjects of a Babylonian king, Venus! Leave for a moment the Lovers Whose souls are crowned with wreaths. O Queen of Shepherds, Carry the water of life to these labourers, So their strength may be appeased As they wait to bathe in the noon-day sea.;Arthur  Rimbaud,;;;;;;;;;;;;;;;;;;
2167;The Poet, therefore, is truly the thief of fire.;Arthur Rimbaud,;;;;;;;;;;;;;;;;;;
2168;Kesän sinisinä iltoina kulkisin polkuja, vehnän raapimana, tallaisin hentoa ruohoa;;;;;;;;;;;;;;;;;;;
2169;You breakFrom earthly approvalAnd common urges:Then soar, accordingly;Arthur Rimbaud,;;;;;;;;;;;;;;;;;;
2170;I will never possess my hand.;Arthur Rimbaud,;;;;;;;;;;;;;;;;;;
2171;O great Ariadne who pour out your tearsOn the shore, as you see, out there on the waves,The sail of Theseus flying white under the sun,O sweet virgin child whom a night has broken,Be silent!-Sun and Flesh (Credo in Unam);Arthur Rimbaud;;;;;;;;;;;;;;;;;;
2172;La început a fost un anumit studiu.Aşterneam pe hârtie tăceri,nopţi,notam inexprimabilul.Fixam vârtejuri.;Arthur Rimbaud,;;;;;;;;;;;;;;;;;;
2173;I saw that all living things were doomed, to bliss: that's not living;;;;;;;;;;;;;;;;;;;
2174;And from then on I bathed in the PoemOf the Sea, infused with stars and lactescent,Devouring the green azure where, like a pale elatedPiece of flotsam, a pensive drowned figure sometimes sinks;;;;;;;;;;;;;;;;;;;
2175;Magical flowers were humming. The turf slopes cradled *him.* Beasts of a fabulous elegance were circulating. Storm clouds were piling up on the rising sea made of an eternity of hot tears.;Arthur Rimbaud,;;;;;;;;;;;;;;;;;;
