S. No;Quotation;Author;;;;;;;;;;;;;;;;;;
1282;"The God has thus made his appearance as Teacher (for we now resume our story), and has assumed the form of a servant. To send another in his place, one high in his confidence, could not satisfy him; just as it could not satisfy the noble king to send in his stead even the most trusted man in his kingdom. But the God had also another reason; for between man and man the Socratic relationship is the highest and truest. If the God had not come himself, all the relations would have remained on the Socratic level; we would not have had the Moment, and we would have lost the Paradox. The Godâ€™s servant-form however is not a mere disguise, but is actual; it is not a parastatic body but an actual body; and from the hour that in the omnipotent purpose of his omnipotent love the God become a servant, he has so to speak imprisoned himself in his resolve, and is now bound to go on (to speak foolishly) whether it pleases him or no.";Søren Kierkegaard,;;;;;;;;;;;;;;;;;;
1283;"If this fact has been naturalized, birth is no longer merely birth, but is at the same time a new birth, so that one who has never before been in existence is born anew -- in being born the first time. In the individual life the hypothesis of naturalization is expressed in the principle that the individual is born with faith; in the life of the race it must be expressed in the proposition that the human race, after the introduction of this fact, has become an entirely different race, though determined in continuity with the first. In that event the race ought to adopt a new name; for there is nothing inhuman about faith as we have proposed to conceive it, as a birth within a birth (the new birth); but if it were as the proposed objection would conceive it, it would be a fabulous monstrosity.";Søren Kierkegaard,;;;;;;;;;;;;;;;;;;
1284;"A good man wishes to serve humanity by presenting a probability-proof, so as to help it accept the improbable. He is successful beyond all measure; deeply moved, he receives congratulations and addresses of thanksgiving, not only from the quality, who know";Søren Kierkegaard,;;;;;;;;;;;;;;;;;;
1285;"The projected hypothesis indisputably makes an advance upon Socrates, which is apparent at every point. Whether it is therefore more true than the Socratic doctrine is an entirely different question, which cannot be decided in the same breath, since we have here assumed a new organ: Faith; a new presupposition: the consciousness of Sin; a new decision: the Moment; and a new Teacher: the God in Time. Without these I certainly never would have dared present myself for inspection before that master of Irony, admired through the centuries, whom I approach with a palpitating enthusiasm that yields to none. But to make an advance upon Socrates and yet say essentially the same things as he, only not nearly so well -- that at least is not Socratic.";Søren Kierkegaard,;;;;;;;;;;;;;;;;;;
1286;"In the scholarly world much is made of classifying literature and assigning the writing of each individual author to its proper place in the age and the writing of the age and in that of the human race. Yet no one thinks about what might be gained if one or another literary type could be trained to read only prologues, but to do it so thoroughly that he would begin with the earliest times and advance through all the centuries down to our own day. Prologues are characterized by the accidental, like dialects, idioms, colloquialisms; they are dominated by fashion in a way entirely different from the way works are-they change like clothing.";Søren Kierkegaard,;;;;;;;;;;;;;;;;;;
1287;By paying attention to the opinion of the visible reading public and of the usual reviewers, one falls into the most fatuous confusion.;Søren Kierkegaard,;;;;;;;;;;;;;;;;;;
1288;For the cultured it is truly too little to have to deal with an individual human being, even though that human being is himself. He does not want to be disturbed when he is to be built up, does not want to be reminded of all the trifles, of individuals, of himself, because to forget all this is precisely the upbuilding. The life of the congregation, the grand definition of the system, the purely human-all of which he does not tempt the individual to think about himself or want to finish something, but builds him up only by his thinking it over-are the subject for consideration in the present work. It is again this totality toward which it strives. The cultured person thus seeks the congregation, to call to mind a word of the poet to whom the present devotional work is so very much indebted and whom I do myself the honor of naming as the authority and as the chosen bard of the cultured, the pondering Professor Heiberg.;Søren Kierkegaard,;;;;;;;;;;;;;;;;;;
1289;does not philosophy teach that if the infinite is thought outside the finite, then both become finitudes? Is it not repeated again and again: truth is the criterion of itself and of the false? Then if philosophy excludes something it renders itself finite. In order to prevent this, it must be willing to explain itself more specifically with regard to my obtuseness and what constitutes it.;Søren Kierkegaard,;;;;;;;;;;;;;;;;;;
1290;when the philosopher becomes blessed through his philosophy, this is an accidental blessedness. There is, then, something higher than philosophy. It is higher in that it includes me and similar bunglers. If this is so, then the question is: will philosophy continue to be called the absolute? But if it is not the absolute, then it must be able to state its boundary. If I wanted to be a poet, the esthetician would certainly instruct me about which capacities are required for that. I would then perceive that I am not a poet and would accept my fate. If, on the other hand, poetry wanted to claim to be the absolute, then it would not dare to exclude me, because the absolute cannot be anything that is not common to all.;Søren Kierkegaard,;;;;;;;;;;;;;;;;;;
1291;Each generation has its own task and need not trouble itself unduly by being everything to previous and succeeding generations. Just as each dayâ€™s trouble is sufficient for the day, so each individual in a generation has enough to do in taking care of himself and does not need to embrace the whole contemporary age with his paternal solicitude or assume that era and epoch begin with his book, and still less with the New Yearâ€™s torch of his promise or with the intimations of his farseeing promises or with the referral of his reassurance to a currency of doubtful value. Not everyone who is stoop-shouldered is an Atlas, nor did he become such by supporting a world. Not everyone who says Lord, Lord, shall enter the kingdom of heaven. Not everyone who offers himself as surety for the whole contemporary age proves by such action that he is reliable and can vouch for himself. Not everyone who shouts Bravo, schwere, Noth, Gottblitz, bravissimo has therefore understood himself and his admiration.;Søren Kierkegaard,;;;;;;;;;;;;;;;;;;
1292;In logic, no movement must come about, for logic is, and whatever is logical only is. The external expression for the logical is what the Eleatics through a misunderstanding transferred to existence: nothing comes into being, everything is.;Søren Kierkegaard,;;;;;;;;;;;;;;;;;;
1293;The Genesis story presents the only dialectically consistent view. Its whole content is really concentrated in one statement: Sin came into the world by a sin. Were this not so, sin would have come into the world as something accidental, which one would do well not to explain. The difficulty for the understanding is precisely the triumph of the explanation and its profound consequence, namely, that sin presupposes itself, that sin comes into the world in such a way by the fact that it is, it is presupposed.;Søren Kierkegaard,;;;;;;;;;;;;;;;;;;
1294;One who has properly occupied himself with psychology and psychological observation acquires a general human flexibility that enables him at once to construct his example which even though it lacks factual authority nevertheless has an authority of a different kind. The psychological observer ought to be more nimble than a tightrope dancer in order to incline and band himself to other people and imitate their attitudes, and his silence in the moment of confidence should be seductive and voluptuous, so that what is hidden may find satisfaction in slipping out to chat with itself in the artificially constructed nonobservance and silence.;Søren Kierkegaard,;;;;;;;;;;;;;;;;;;
1295;The concept of race is too abstract to allow the positing of so concrete a category as sin, which is posited precisely in that the single individual himself, as the single individual, posits it. Thus sinfulness in the race becomes only a quantitative approximation.;Søren Kierkegaard,;;;;;;;;;;;;;;;;;;
1296;If a person does not first make clear to himself the meaning of â€œself,â€ it is of no use to say of sin that it is selfishness. Only when the concept of the particular is given can there be any talk of selfishness, however, no science can say what the self is without stating it quite generally. And this is the wonder of life, that each man who is mindful of himself knows what no science knows, since he knows who he himself is, and this is the profundity of the Greek saying know yourself, which too long has been understood in the German way as pure self-consciousness, the airiness of idealism.;Søren Kierkegaard,;;;;;;;;;;;;;;;;;;
1297;Man is a synthesis of psyche and body, but he is also a synthesis of the temporal and the eternal. In the former, the two factors are psyche and body, and spirit is the third, yet in such a way that one can speak of a synthesis only when the spirit is posited. The latter synthesis has only two factors, the temporal and the eternal. Where is the third factor? And if there is no third factor, there really is no synthesis, for a synthesis that is a contradiction cannot be completed as a synthesis without a third factor, because the fact that the synthesis is a contradiction asserts that it is not. What, then, is the temporal?;Søren Kierkegaard,;;;;;;;;;;;;;;;;;;
1298;Spiritlessness can say exactly the same thing that the richest spirit has said, but it does not say it by virtue of spirit. Man qualified as spiritless has become a talking machine, and there is nothing to prevent him from repeating by rote a philosophical rigmarole, a confession of faith, or a political recitation. Is it not remarkable that the only ironist and the greatest humorist joined forces in saying what seems the simplest of all, namely, that a person must distinguish between what he understands and what he does not understand.;Søren Kierkegaard,;;;;;;;;;;;;;;;;;;
1299;There is only one proof of spirit and that is the spiritâ€™s proof within oneself. Whoever demands something else may get proofs in superabundance, but he is already characterized at spiritless.;Søren Kierkegaard,;;;;;;;;;;;;;;;;;;
1300;Life offers sufficient phenomena in which the individual in anxiety gazes almost desirously at guilt and yet fears it. Guilt has for the eye of the spirit the fascinating power of the serpentâ€™s glance.;Søren Kierkegaard,;;;;;;;;;;;;;;;;;;
1301;"Nay, truthâ€”which abhors also this untruth of aspiring after broad dissemination as the one aimâ€”is not nimble on its feet. In the first place it cannot work by means of the fantastical means of the press, which is the untruth; the communicator of the truth can only be a solitary individual. And again the communication of it can only be addressed to the individual.";Søren Kierkegaard,;;;;;;;;;;;;;;;;;;
1302;The demonstration of the existence of God is something with which one learnedly and metaphysically occupies oneself only on occasion, but the thought of God forces itself upon a man on every occasion. What is it that such an individuality lacks? Inwardness.;Søren Kierkegaard,;;;;;;;;;;;;;;;;;;
1303;"If a human being were a beast or an angel, he could not be in anxiety. Because he is a synthesis, he can be in anxiety; and the more profoundly he is in anxiety, the greater is the manâ€”yet not in the sense usually understood, in which anxiety is about something external, about something outside a person, but in the sense that he himself produces the anxiety. Only in this sense can the words be understood when it is said of Christ that he was anxious unto death, as well as the words spoken by Christ to Judas: What you are going to do, do quickly.";Søren Kierkegaard,;;;;;;;;;;;;;;;;;;
1304;It may be judged how important is The Concept of Dread from the fact that besides the German translation there are two translations in French and one in Spanish. It is the first time I have had the pleasure of comparing four translations with the original text. It is hard on the eyes to keep five texts in view when I am making my translation, but it is interesting. I soon discovered to my chagrin that the Spanish translation was made, not from the Danish, but from Schrempfâ€™s translation, and therefore could be discarded. The translator had not emulated the noble example of Don Miguel de Unamuno, who said in one of his essays, â€œI learned the language for the sake of reading Ibsen and was rewarded by reading Kierkegaard.â€ Because this translator was only a hack hired by a publisher, his name is not given. But of the French translations, which were both published in 1935 and are therefore entirely independent, it would be churlish of me to say that they are not very good, seeing that I have profited much by both of them.;Søren Kierkegaard,;;;;;;;;;;;;;;;;;;
1305;â€¦ this little book [â€¦] seeks that single individual whom I with joy and gratitude call my reader, or it does not even seek him. Unaware of the time and the hour, it quietly waits for that right reader to come like the bridegroom and to bring the occasion along with him. Let each do a share-the reader therefore more.;Søren Kierkegaard,;;;;;;;;;;;;;;;;;;
1306;"Father in heaven, how well we know that seeking always has its promise; how much the more, then, seeking you, the giver of all the promises and of all good gifts! How well we know that the seeker does not always need to wander out into the world, because the more holy that is which he seeks, the closer it is to him, and if he seeks you, O God, you are closest of all to him! But we also know that seeking always has its toil and its spiritual trial-how much more, then, the terror in seeking you, you Mighty One!";Søren Kierkegaard,;;;;;;;;;;;;;;;;;;
1307;Whoever says that this stillness does not exist is merely making noise.;Søren Kierkegaard,;;;;;;;;;;;;;;;;;;
1308;If anyone has the task of preaching or teaching others about their guilt, of teaching-something that this discourse, which is without authority, does not do-he does have the consolation that the purest heart is precisely the one most willing to comprehend his own guilt most deeply.;Søren Kierkegaard,;;;;;;;;;;;;;;;;;;
1309;Alas, although there come to be more and more who know so very much, experienced people are becoming more and more rare!;Søren Kierkegaard,;;;;;;;;;;;;;;;;;;
1310;"The wedding ceremony is like a wreath of eternity, but love weaves it, and duty says it must be woven; and loveâ€™s delight is to weave it, and duty says it must be woven-every day from the flower of the moment. Here eternity is not finished with time, but the covenant is eternityâ€™s beginning in time; the eternal resolution and the duty for eternity must remain with the wedded pair in the union of love through time, and there is be celebration at its remembrance and power in its recollection and hope in its promise.";Søren Kierkegaard,;;;;;;;;;;;;;;;;;;
1311;Death does not have the power to create unhappiness;Søren Kierkegaard,;;;;;;;;;;;;;;;;;;
1312;"There is a government loan officer where the poor can go. The indigent person is helped, but do the poor have a joyful conception of this loan office? Likewise, there perhaps are marriages that seek God only in adversity, alas, and seek him as a loan office; and anyone who only then seeks him always runs this danger. Would such a late resolution, which even though worthy is still not bought at the last moment without shame and without great danger-would it be more beautiful and wiser than the first resolution of marriage?";Søren Kierkegaard,;;;;;;;;;;;;;;;;;;
1313;The person who is without God in the world soon becomes bored with himself-and expresses this haughtily by being bored with all life, but the person who is in fellowship with God indeed lives with the one whose presence gives infinite significance to even the most insignificant.;Søren Kierkegaard,;;;;;;;;;;;;;;;;;;
1314;Time also is a good.;Søren Kierkegaard,;;;;;;;;;;;;;;;;;;
1315;Earnestness understands the same thing about death but understands it in a different way. It understands that death makes all equal, and this it has already understood, because earnestness has taught it to seek before God the equality in which all are able to be equal.;Søren Kierkegaard,;;;;;;;;;;;;;;;;;;
1316;See, one can have an opinion about remote events, about a natural object, about nature, about scholarly works, and about another human being, and so on about much else, and when one expresses this opinion the wise person can decide whether it is correct or incorrect.;Søren Kierkegaard,;;;;;;;;;;;;;;;;;;
1317;"What a splendid occupation to prepare a secret for oneself, how seductive to enjoy it, and yet at times how precarious to have enjoyed it, how easy for it to miscarry for one. In other words, if someone believes that a secret is transferable as a matter of course, that it belongs to the bearer, he is mistaken, for the [riddle] â€œOut of the eater comes something to eatâ€ is valid here; but if anyone thinks that the only difficulty entailed in enjoying it is not to betray it, he is also mistaken, for one also takes on the responsibility of not forgetting it. Yet it is even more disgusting to recollect incompletely and to turn oneâ€™s soul into a transit warehouse for damaged goods.";Søren Kierkegaard,;;;;;;;;;;;;;;;;;;
1318;When memory is refreshed again and again, it enriches the soul with a mass of details that distract recollection.;Søren Kierkegaard,;;;;;;;;;;;;;;;;;;
1319;When I now think of this, it seems almost absurd to me that five such people planned a banquet. Most likely nothing would have come of it had not Constantin Constantius been along.;Søren Kierkegaard,;;;;;;;;;;;;;;;;;;
1320;How rich is language in the service of desire in comparison with language when it describes actuality.;Søren Kierkegaard,;;;;;;;;;;;;;;;;;;
1321;if love is ludicrous, it is just as ludicrous whether I find a princess or a servant girl;Søren Kierkegaard,;;;;;;;;;;;;;;;;;;
1322;What a strange invention is marriage! Is it something pagan or something Christian, or something sacred or something secular, or something civil or a little of everything?;Søren Kierkegaard,;;;;;;;;;;;;;;;;;;
1323;I shall speak in praise of woman. Just as the person who is supposed to talk about the divine must be inspired by the divine in order to be able to talk worthily and therefore is taught what he is to say by the divine himself, so it is also with speaking about woman. Woman, even less than the god, is a whim from a manâ€™s brain, a daydream, something one hits upon all by oneself and argues about pro et contra. No, only from her herself does one learn to talk about her.;Søren Kierkegaard,;;;;;;;;;;;;;;;;;;
1324;He jumped in through the window, and just as he was jumping out, the others, who had been looking at him, were standing nearby. Triumphantly holding some papers in his hands, he shouted, â€œA manuscript by His Honor the Judge. If I have published his others, it is no more than my duty to publish this also.â€ Who am I? I am not worth asking about, for I am the least of all, and people make me very bashful by asking this question. I am pure being and thus almost less than nothing. I am the pure being and thus almost less than nothing.;Søren Kierkegaard,;;;;;;;;;;;;;;;;;;
1325;"My dear reader, if you do not have the time and opportunity to take a dozen years of your life to travel around the world to see everything a world traveler is acquainted with, if you do not have the capability and qualifications from years of practice in a foreign language to penetrate to the differences in national characteristics as these become apparent to the research scholar, if you are not bent upon discovering a new astronomical system that will displace both the Copernican and the Ptolemaic-then marry; and if you have time for the first, the capability for the second, the idea for the last, then marry also.";Søren Kierkegaard,;;;;;;;;;;;;;;;;;;
1326;Only the divine justice of marriage is able continually to give like for like.;Søren Kierkegaard,;;;;;;;;;;;;;;;;;;
1327;"A positive resolution has only one risk-not to be true to itself; a negative resolution always has a double danger: not to be true to itself, which resembles the danger in the positive resolution with the one difference that all this faithfulness is without reward, is a faded glory and as barren as a bachelorâ€™s life; and then the second risk-whether all this faithfulness whereby one is true to oneself in oneâ€™s negative resolution is not a deviation that for all its faithfulness is eventually rewarded with repentance.";Søren Kierkegaard,;;;;;;;;;;;;;;;;;;
1328;In that little book [On the Nobility and Excellence of the Female Sex, and the Superiority of the Same over the Male Sex, by Heinrich Cornelius Agrippa, 1486â€“1535] it is adduced as proof that in Hebrew woman is called Eve (life), man is called Adam (earth) â€“ ergo. Something like this is excellent as a jest in an exchange of words in which everything is absolutely decided and signed and sealed with both the notary publicâ€™s seal and Godâ€™s. So it is also when the author cites in another demonstration that when a woman falls into the water she floats on top whereas a man, if he falls into the water, sinks-ergo. This demonstration lends itself to other uses, which helps explain the fact that so many witches were burned in the Middle Ages. It is a few years since I read that little book, but it was highly amusing to me. The most comical things in the natural sciences and philology appear in the most naÃ¯ve way.;Søren Kierkegaard,;;;;;;;;;;;;;;;;;;
1329;Is an author less rich in ideas because ordinary observation finds nothing, while the reader who has made him his sole study nevertheless discovers an ever-greater wealth? Is it a perfection in human works of art that they look best at a distance? Is it an imperfection in the meadow flower, as in all the works of God, that under microscopic scrutiny it becomes lovelier and lovelier, more and more exquisite, more and more delicate?;Søren Kierkegaard,;;;;;;;;;;;;;;;;;;
1330;"Nowadays woman is continually characterized in the highest terms, in the most flattering phrases, up to, indeed, far beyond the fantastic. Everything that is great in life is ascribed to her; on this point poetry and gallantry agree.";Søren Kierkegaard,;;;;;;;;;;;;;;;;;;
1331;A resolution must be added to falling in love. But a resolution presupposes reflection, but reflection is immediacyâ€™s angel of death. So it stands, and if it was right that reflection should attack falling in love, then there will never be a marriage. But that is precisely what it should not do-indeed, what is more, even prior to and simultaneously with this process, which through reflection comes to a resolution, there is the negative resolution that fends off any reflection of this nature as a spiritual temptation. While reflectionâ€™s destroying angel of death ordinarily goes about calling for death to the immediate, there is still one immediacy it allows to stand-the immediacy of falling in love, which is a wonder.;Søren Kierkegaard,;;;;;;;;;;;;;;;;;;
1332;The religious abstraction desires to belong to God alone;Søren Kierkegaard,;;;;;;;;;;;;;;;;;;
1333;Importunity toward God is a kind of impertinent camaraderie, even if he himself does not understand it that way. He can even be truly humble, but in the very same way, humanly speaking, a subordinate can have the most loyal enthusiasm for his king and be far superior to those who are neither hot nor cold but are numbers and cattle, but yet when he seeks an audience with the king he can wish to be permitted to enter through a door different from the one assigned to all subjects. To me it seems that there must be something terrible about his being turned away and hearing those words: The other way, then we shall see what can be done.;Søren Kierkegaard,;;;;;;;;;;;;;;;;;;
1334;"What gives the lake an even more inclosed look is that the quagmire is thickly overgrown with reeds; indeed, there is nothing like it in Denmark, at least so says my friend the naturalist. Only in one place has a little waterway been opened up; here, there is a flat-bottomed boat, in which we two, he on behalf of science and I on behalf of friendship and curiosity, poled ourselves out. With effort we brought the boat out, for the channel has hardly a foot of water.";Søren Kierkegaard,;;;;;;;;;;;;;;;;;;
